{
  "register_id": "SMART-GUITAR-COMPONENT-REGISTER-V1",
  "product_ref": "external:luthiers-toolbox/services/api/app/instrument_geometry/body/specs/smart_guitar_v1.json@v1.1",
  "status": "draft",
  "units": "mm",
  "body": {
    "body_id": "SMART-GUITAR-BODY-BLANK-V1",
    "description": "Smart Guitar body blank, Explorer-derived ergonomic solidbody. Official CAD length 468.5 mm, derived width 402.85 mm. Thickness 47.0 mm (see CONF-BODY-THICKNESS).",
    "stated_thickness_mm": 47.0,
    "provenance": {
      "source": "vendored_snapshot",
      "source_ref": "luthiers-toolbox smart_guitar_v1.json v1.1 body.dimensions.thickness_mm",
      "snapshot_date": "2026-07-26",
      "confidence": "draft",
      "note": "Thickness set to 47.0 mm on 2026-07-27. Enlarged from 44.45 to clear opposed-face web violations among spec-native cavities; 47.0 is the binding requirement from control_cavity (20) against bridge_pickup_route (19), and teensy_io_pocket (20) against neck_pickup_route (19), at min_web 8.0. Briefly held at 51.0 on the strength of an antenna recess that turned out not to be a body cavity at all."
    }
  },
  "components": [
    {
      "component_id": "PI5",
      "display_name": "Raspberry Pi 5 (8 GB)",
      "role": "Linux music brain — JACK + Guitarix/MODEP effects host",
      "length_mm": 85.0,
      "width_mm": 56.0,
      "height_mm": 18.0,
      "mounting": "floor",
      "standoff_mm": 6.0,
      "margin_length_mm": 4.0,
      "margin_width_mm": 4.0,
      "lid_clearance_mm": 3.0,
      "consumes_cavity_depth": true,
      "required": true,
      "provenance": {
        "source": "vendored_snapshot",
        "source_ref": "sg-spec smart_guitar_cavity_map.json electronics_components.pi5",
        "snapshot_date": "2026-07-26",
        "confidence": "draft",
        "note": "Height 18.0 per sg-spec, which the owner ruled canonical. luthiers-toolbox states 17.0 for the same board; see conflict CONF-PI5-HEIGHT. lid_clearance 3.0 mm is an engineering estimate for cable dressing, not a sourced value."
      }
    },
    {
      "component_id": "SG_AUDIO_FRONTEND",
      "display_name": "Smart Guitar audio front end (custom HAT)",
      "role": "Instrument front end, codec, headphone amp, bypass relay and I/O microcontroller on one board",
      "length_mm": 65.0,
      "width_mm": 56.5,
      "height_mm": 24.0,
      "mounting": "floor",
      "standoff_mm": 6.0,
      "margin_length_mm": 4.0,
      "margin_width_mm": 4.0,
      "lid_clearance_mm": 3.0,
      "consumes_cavity_depth": true,
      "required": true,
      "provenance": {
        "source": "engineering_estimate",
        "source_ref": "fixtures/subassemblies/sg_audio_frontend_v1.json envelope",
        "snapshot_date": "2026-07-27",
        "confidence": "draft",
        "note": "Dimensions are the ENVELOPE from SUBASSEMBLY-SG-AUDIO-FRONTEND-V1, not a measured part — no schematic exists. height_mm is the design TARGET of 24.0, chosen to match the HiFiBerry DAC+ADC it replaces so the pocket does not move; the hard ceiling is 30.0 before the blank must grow. This component also absorbs the Teensy 4.1, which is why no separate MCU pocket remains: that is what makes the electronics fit the solid body."
      }
    },
    {
      "component_id": "BATTERY_PACK",
      "display_name": "Battery pack + BMS (4x 18650)",
      "role": "Power supply, USB-C PD 20 W charging",
      "length_mm": 80.0,
      "width_mm": 45.0,
      "height_mm": 18.0,
      "mounting": "floor",
      "standoff_mm": 0.0,
      "margin_length_mm": 5.0,
      "margin_width_mm": 5.0,
      "lid_clearance_mm": 3.0,
      "consumes_cavity_depth": true,
      "required": true,
      "provenance": {
        "source": "vendored_snapshot",
        "source_ref": "sg-spec smart_guitar_cavity_map.json electronics_components.battery_pack",
        "snapshot_date": "2026-07-26",
        "confidence": "draft",
        "note": "Pack dimensions per sg-spec. luthiers-toolbox instead lists a single 6000 mAh 18650 cell at 65 x 18.3 mm sited beside the Pi 5. See conflict CONF-BATTERY-PLACEMENT."
      }
    },
    {
      "component_id": "FAN_40MM",
      "display_name": "40 mm cooling fan",
      "role": "Thermal management for the Pi 5 in a closed cavity",
      "length_mm": 40.0,
      "width_mm": 40.0,
      "height_mm": 10.0,
      "mounting": "lid",
      "standoff_mm": 0.0,
      "margin_length_mm": 2.0,
      "margin_width_mm": 2.0,
      "lid_clearance_mm": 0.0,
      "consumes_cavity_depth": false,
      "required": true,
      "provenance": {
        "source": "vendored_snapshot",
        "source_ref": "sg-spec smart_guitar_cavity_map.json electronics_components.fan_40mm",
        "snapshot_date": "2026-07-26",
        "confidence": "draft",
        "note": "consumes_cavity_depth is false: the fan vents OUTWARD through the cover rather than sitting inside the cavity depth. RULED by the owner on 2026-07-26 (CONF-FAN-INTRUSION), confirming the modelled configuration. Had it been mounted internally the blank would fail by 6.55 mm, which is why the counterfactual is kept under test. The lid requires vents."
      }
    },
    {
      "component_id": "NVME_SSD",
      "display_name": "NVMe SSD, M.2 2280, 128 GB",
      "role": "Storage (optional)",
      "length_mm": 80.0,
      "width_mm": 22.0,
      "height_mm": 3.5,
      "mounting": "floor",
      "standoff_mm": 0.0,
      "margin_length_mm": 4.0,
      "margin_width_mm": 4.0,
      "lid_clearance_mm": 0.0,
      "consumes_cavity_depth": false,
      "required": false,
      "provenance": {
        "source": "vendored_snapshot",
        "source_ref": "luthiers-toolbox smart_guitar_v1.json rear_electronics_cavity.contains[NVMe SSD]",
        "snapshot_date": "2026-07-26",
        "confidence": "draft",
        "note": "Deliberately NOT placed in any cavity plan. The source sites it 'under Pi 5', where its 3.5 mm would fit inside the Pi's 6 mm standoff gap and consume no additional depth or plan area. That is an assumption, not a derivation, so the part is registered and left unplaced rather than modelled falsely. See conflict CONF-NVME-PLACEMENT."
      }
    },
    {
      "component_id": "GPIO_RIBBON",
      "display_name": "Pi 5 GPIO to HiFiBerry ribbon/riser",
      "role": "Carries the I2S bus between the Pi 5 and the HiFiBerry HAT once they no longer stack",
      "length_mm": 100.0,
      "width_mm": 26.0,
      "height_mm": 2.0,
      "mounting": "floor",
      "standoff_mm": 0.0,
      "margin_length_mm": 0.0,
      "margin_width_mm": 2.0,
      "lid_clearance_mm": 3.0,
      "consumes_cavity_depth": true,
      "required": true,
      "provenance": {
        "source": "engineering_estimate",
        "source_ref": "required by CONF-POD-LAYOUT: side-by-side placement forbids header stacking",
        "snapshot_date": "2026-07-27",
        "confidence": "draft",
        "note": "length_mm 100.0 is a stock GPIO extension ribbon. CORRECTED from 60.0 on 2026-07-27: 60 mm was geometrically IMPOSSIBLE. POD_PI and POD_HAT need at least 72.25 mm centre-to-centre stacked, or 91.00 mm side by side, before their 8 mm walls clear — so a 60 mm ribbon forbade the two pockets from coexisting anywhere, at any body size. That length had been chosen on an AREA argument about the channel's own cost, without checking it was long enough to be buildable. It is registered as a component so pocket separation stays constrained, but the constraint has to be physically possible to be worth anything."
      }
    }
  ],
  "cavity_plans": [
    {
      "cavity_id": "POD_PI",
      "description": "Rear-access pocket for the Raspberry Pi 5, with a lid-mounted cooling fan",
      "surface": "back",
      "layout": "side_by_side",
      "component_ids": [
        "PI5",
        "FAN_40MM"
      ],
      "inter_component_margin_mm": 4.0,
      "min_floor_mm": 8.0,
      "provenance": {
        "source": "engineering_estimate",
        "source_ref": "split from ELECTRONICS_POD, 2026-07-27, per CONF-POD-SPLIT",
        "snapshot_date": "2026-07-27",
        "confidence": "draft",
        "note": "The one-piece 162 x 64 pod had NO valid position anywhere in the body outline once containment, rim inset and through-body voids were checked. Splitting is not a preference; it is what makes the electronics placeable at the governed body size."
      }
    },
    {
      "cavity_id": "POD_HAT",
      "description": "Rear-access pocket for the custom audio front-end board, linked to POD_PI by the GPIO ribbon",
      "surface": "back",
      "layout": "single",
      "component_ids": [
        "SG_AUDIO_FRONTEND"
      ],
      "inter_component_margin_mm": 0.0,
      "min_floor_mm": 8.0,
      "provenance": {
        "source": "engineering_estimate",
        "source_ref": "split from ELECTRONICS_POD, 2026-07-27, per CONF-POD-SPLIT",
        "snapshot_date": "2026-07-27",
        "confidence": "draft",
        "note": "Sized from the subassembly envelope rather than from a measured board. Retains the HAT-derived footprint deliberately: matching the part it replaces keeps this pocket stable while the board is still a brief."
      }
    },
    {
      "cavity_id": "WIRE_CHANNEL_PI_HAT",
      "description": "Routed channel carrying the GPIO ribbon between POD_PI and POD_HAT",
      "surface": "back",
      "layout": "single",
      "component_ids": [
        "GPIO_RIBBON"
      ],
      "inter_component_margin_mm": 0.0,
      "min_floor_mm": 8.0,
      "stated_width_mm": 10.0,
      "stated_depth_mm": 15.0,
      "provenance": {
        "source": "engineering_estimate",
        "source_ref": "sg-spec rear_wiring_channel (10 x 15 mm) compared against a 40-way ribbon",
        "snapshot_date": "2026-07-27",
        "confidence": "draft",